<?xml version="1.0" encoding="UTF-8"?>
<xs:schema xmlns:xs="http://w3.org">


  <xs:element name="biblioteca">
    <xs:complexType>
      <xs:sequence>
        <xs:element name="libro" maxOccurs="unbounded">
          <xs:complexType>
            <xs:sequence>
              <xs:element name="titulo" type="xs:string"/>
              <xs:element name="autor" type="xs:string"/>
              <xs:element name="paginas" type="xs:positiveInteger"/>
              <xs:element name="disponible" type="xs:boolean"/>
            </xs:sequence>
  
            <xs:attribute name="id" type="xs:string" use="required"/>
          </xs:complexType>
        </xs:element>
      </xs:sequence>
    </xs:complexType>
  </xs:element>

</xs:schema>
